{
  "growth_law": "logistic",
  "growth_rate": 0.008,
  "carrying_capacity_ml": 260.0,
  "drug_sensitivity": {
    "anthracycline": 0.09,
    "taxane": 0.075,
    "endocrine_agent": 0.015,
    "her2_directed_agent": 0.06
  },
  "drug_ec50": {
    "anthracycline": 0.5,
    "taxane": 0.5,
    "endocrine_agent": 0.7,
    "her2_directed_agent": 0.5
  },
  "drug_decay": {
    "anthracycline": 0.25,
    "taxane": 0.2,
    "endocrine_agent": 0.06,
    "her2_directed_agent": 0.16
  },
  "resistant_fraction": 0.28,
  "resistant_sensitivity_scale": 0.05,
  "observation_noise_fraction": 0.12
}
